酒名,url,酒譜,介紹,步驟,口味,評論
Spicy Mint Avocado Margarita,https://www.liquor.com/recipes/spicy-mint-avocado-margarita/,"{'avocado ': '1 slice', 'jalapeño pepper ': '3 slice', 'Mint leaves': '4 fresh', 'blanco tequila': '2 ounce', 'orange liqueur': '1 ounce', 'fresh lime juice': '1 ounce', 'ounce Simple syrup': '1/2 ounce', 'salt': '1 pinch'}","['Most people can recite the health benefits of the mighty avocado—loaded with nutrients, antioxidants and plenty of that good fat—but few think of it as a cocktail ingredient. This Margarita spin doubles down on the green, muddling the superfruit with fresh mint and jalapeño for a warm-weather sipper that will make you feel good in more ways than one.']","['Rim a double rocks glass with salt and set aside.', 'Add the avocado, jalapeño, mint and lime juice into a shaker and muddle until the avocado is mashed.', 'Add the tequila, orange liqueur, simple syrup and salt.', 'Fill the shaker with ice, and shake until well-chilled.', 'Strain into the prepared rocks glass over fresh ice.', 'Garnish with a mint sprig.']",Sweet,"[[""I've never seen a recipe in which ingredients are place in a mixing glass, then *shaked* with ice. Was this a typo? And if not, how does one shake a cocktail in a mixing glass?""], [""Thanks for bringing this to our attention. We've updating the recipe's instructions.""]]"
Latitude 29 Mai Tai,https://www.liquor.com/recipes/mai-tai/,"{'Coruba dark Jamaican rum': '1 ounce', 'Rhum Clément V S O P  Martinique rhum agricole vieux': '1 ounce', 'Orange curaçao': '1/2 ounce', 'Latitude 29 Formula orgeat': '1/2 ounce', 'Fresh lime juice ': '1 ounce', 'Simple syrup ': '1/4 ounce'}","['The Mai Tai is the quintessential torch carrier of Tiki. It made its flowery foray into American culture between the 1930s and ’50s, thanks to tropical-minded entrepreneurs like Ernest Raymond Beaumont Gantt (a.k.a. Donn Beach) and Victor Jules Bergeron (a.k.a. Trader Vic). This classic recipe comes from Tiki historian Jeff “Beachbum” Berry, the owner of New Orleans’ ode to Tikidom, Latitude 29.', 'This recipe originally appeared as part of “How the Mai Tai Became the Calling Card for the Tiki Movement.”']","['Add all the ingredients into a shaker with 2 scoops of crushed ice, and shake well for 10 seconds.', 'Pour unstrained into a double Old Fashioned glass.', 'Sink the spent lime shell into the drink.', 'Garnish with a mint sprig.']",Sweet,NULL
Blue Hawaiian,https://www.liquor.com/recipes/blue-hawaiian/,"{'Light rum': '11/2 ounce', 'Blue curaçao': '3/4 ounce', 'Pineapple juice': '2 ounce', 'Creme de coconut': '3/4 ounce', 'Fresh lemon juice': '1/2 ounce'}","['Not to be confused with the Harry Yee classic, the Blue Hawaii, the Blue Hawaiian is little more than a Piña Colada with an added splash of blue curaçao. Tall, teal and aggressively tropical, it’s the type of drink you’d imagine sipping by the swimming pool, another cocktail du azure.']","['Add all ingredients into a shaker with ice and shake until well-chilled.', 'Strain into a Hurricane glass over pebble ice.', 'Garnish with a pineapple wedge, cherry and cocktail umbrella. into glass.']",Sweet,NULL
Bourbon Rosemary Punch,https://www.liquor.com/recipes/bourbon-rosemary-punch/,"{'Rosemary-infused Aperol ': '1 bottle', 'Bourbon': '12 ounce', 'Honey syrup': '6 ounce', 'Grapefruit juice': '6 ounce', 'Dry sparkling wine ': '1 bottle', 'Soda water ': '1 bottle'}","['The prettiest punches aren’t always the tastiest. Not the case with this party-size bourbon-Aperol number. It’s got everything you want from a large-format cocktail: fresh, seasonal flavors and bright, beautiful garnishes, plus a whole lot of bubbles to make the whole thing feel more festive.']","['Combine the first four ingredients in a punch bowl and add large ice cubes.', 'Top with the sparkling wine and soda water.', 'Garnish with grapefruit wheels and rosemary sprigs.', '*Rosemary-infused Aperol: Place 4 sprigs of rosemary in a 750 mL bottle of Aperol and let sit for 6 hours at room temperature, then strain out herbs.']",Sweet,NULL
Brown Derby,https://www.liquor.com/recipes/brown-derby/,"{'Bourbon': '11/2 ounce', 'Fresh grapefruit juice': '1 ounce', 'Honey syrup': '1/2 ounce'}","[""The classic bourbon Brown Derby cocktail is named for the eponymous hat-shaped Los Angeles diner. It's both sweet and sour with a hefty dose of grapefruit juice and a touch of honey syrup. Try this recipe now to find out what all the hype is about.""]","['Add all ingredients into a shaker with ice and shake.', 'Fine-strain into a cocktail glass.', 'Express the oil from a grapefruit twist and drop in to garnish (or garnish with a grapefruit wedge).', '*Honey syrup: Add 1/2 cup honey and 1/2 cup water to a small saucepan over medium heat. (You can experiment and decide how much of a honey flavor you want in your syrup. The more honey you use, the thicker the syrup and stronger in flavor it will be.) Stir until blended. Strain into a jar and seal tightly with a lid. Will keep for 1 month in the refrigerator.']",Sweet,"[['Very refreshing drink, the honey mellows the bitterness of the grapefruit just enough but neither overpower the drink which allows the bourbon to retain the backbone (though I do prefer a bottle in bond bourbon that stands up a little more to the grapefruit juice).'], ['we loved it adding to our list of cocktails - I was lucky enough to have eaten at the BrownDerby...........']]"
Bulleit Bourbon Kentucky Buck,https://www.liquor.com/recipes/bulleit-bourbon-kentucky-buck/,"{'Fresh lemon juice': '1/2 ounce', 'Medium strawberry': '1', 'Bulleit bourbon': '11/2 ounce', 'Simple syrup': '1/2 ounce', 'Angostura bitters': '2 dash', 'Ginger beer': 'to top'}","[""Love bourbon? Don't miss this simple and delicious whiskey drink.""]","['In a shaker, muddle the lemon juice and strawberry.', 'Add the bourbon, simple syrup, bitters and ice and shake.', 'Strain into a Collins glass over fresh ice.', 'Top with the ginger beer.', 'Garnish with a skewered lemon wheel and a thinly sliced strawberry.']",Sweet,NULL
Tom Yum on a Rock,https://www.liquor.com/recipes/tom-yum-on-a-rock/,"{'Lime': '1 wedge', 'Makrut lime leaf': '1', ' Chopped lemongrass ': '1 stalk', 'Fresh lime juice': '1 ounce', 'Beluga vodka': '13/4 ounce', 'Cointreau': '2/3 ounce', 'Palm sugar syrup ': '2/3 ounce'}","['There’s nothing quite like this tangy, spicy sipper at Six Senses resort bar The Den on Koh Yao Noi, Thailand, while taking in the sweeping views of Phang Nga Bay and the islands and rock formations in the distance. It’s reminiscent of the Thai hot and sour soup, and the drink’s secret weapon is TomYam syrup made from a closely guarded recipe. (“Tom” refers to the boiling process, while “yam” is a spicy and sour salad.”) It has been replaced here with palm sugar syrup. To amp up the aromatics, muddle more makrut and lemongrass, as well as some galangal and ginger.', 'This recipe originally appeared as part of “How to Turn Your Favorite Asian Dish into a Cocktail.”']","['Rub the lime wedge on half of the outer rim of a rocks glass, and coat the glass in a mixture of equal-parts red pepper flakes and sea salt and set aside.', 'Add the makrut lime leaf, lemongrass and lime juice into a shaker and muddle gently.', 'Add the vodka, Cointreau, syrup and ice and shake until well-chilled.', 'Double-strain into the prepared glass over fresh ice.', 'Garnish with a lime wheel and red chile pepper on a bamboo pick.']",Savory,[['33/50 = 2/3-oz ???']]
Duck Fried Rice,https://www.liquor.com/recipes/duck-fried-rice/,"{'lemongrass-infused gin': '1 ounce', 'sesame-infused vodka': '1 ounce', 'Bittermens tepache spiced pineapple liqueur': '1/2 ounce', 'MSG': '1 dash', 'fresh lime juice': '1/2 ounce'}","['“It’s a fusion and reflection of our culinary direction and cocktail creativity,” says Laine Peterson, the manager of The Up Room in Chicago’s Robey hotel, about this cocktail variation on the popular Chinese side dish. “It’s something familiar, a Moscow Mule meets globally influenced comfort food in drink form.” Lemongrass refreshes while sesame and ginger offer a savory note and tepache—a fermented spicy pineapple liqueur originating in Mexico and South America—adds sweetness. The original recipe called for duck fat to be sprayed on top, but that’s been omitted to appeal to vegetarians.', 'This recipe originally appeared as part of “How to Turn Your Favorite Asian Dish into a Cocktail.”']","['Add the gin, vodka, liqueur and MSG into a shaker with ice and shake until well-chilled.', 'Strain into a miso soup cup over an ice sphere.', 'Garnish with a fortune cookie.']",Savory,NULL
Pho-King Champ,https://www.liquor.com/recipes/pho-king-champ/,"{'Absolut Elyx vodka': '33/50 ounce', 'Dry Sack 15-year-old oloroso sherry': '1/4 ounce', 'Pho broth': '1 ounce', 'Fresh lime juice': '1/4 ounce', 'Mineral saline ': '2 drops'}","['“A twist on the classic Bull Shot reimagined through the lens of Vietnamese pho” is how Chad Solomon, the co-creator of Midnight Rambler in Dallas, describes this drink. The name is a nod to the defunct San Francisco avant rock band The Fucking Champs, who were forced to change their name from The Champs when they were called out by the original 1950s band. The house-made broth has incredible depth of flavor. But if you don’t want to take the time to make it, set aside a few ladlefuls from your favorite pho joint.', 'This recipe originally appeared as part of “How to Turn Your Favorite Asian Dish into a Cocktail.”']","['Add all ingredients into a shaker with ice and shake until chilled.', 'Strain into a shot glass.', 'Garnish with a cilantro leaf.', '*Pho broth: Roast 1/2 lb peeled and quartered white onion and 2 oz peeled and halved ginger root at 350 degrees for 25 minutes. Grind and pan-toast 3/4 tsp black cardamom, 3/4 tsp green cardamom, 8 star anise pods, one 3-inch stick cassia bark, 1 1/4 tsp black peppercorns and 1 tsp allspice. Add ground and toasted spices, roasted onion and ginger to 1 qt boiling Kitchen Basics no-sodium beef stock. Remove from heat, let infuse for 30 minutes and fine-strain through a chinois followed by a 50 micron superbag. To the strained broth add 1 tsp salt, 2 tbsp sugar, 2 tsp fish sauce, 1/3 tsp Sriracha, 2 1/2 tbsp hoisin sauce, 1/3 tsp. Bragg liquid aminos and stir well. Store in the refrigerator.']",Savory,[['I was there for the creation of this shot and it is so amazing and so delicious.']]
Horn of the Bulls,https://www.liquor.com/recipes/horn-of-the-bulls/,"{'El Jimador blanco tequila': '11/2 ounce', 'Midori': '1/2 ounce', 'cucumber syrup': '1/2 ounce', 'pineapple juice': '3/4 ounce', 'heavy cream': '3/4 ounce', 'egg white': '1 ounce', 'salt': '1 pinch', 'chilled soda water': 'to top'}","['Will Lee, the beverage director of Grey Ghost and Second Best in Detroit, is a big fan of pairing Midori with white grassy spirits like herbaceous gins and blanco tequilas, as well as salty ingredients, as in this cocktail. As for the green liqueur’s propensity for sweetness, he says, “As long as you’re able to balance those flavors, it can be a great complementary component to use in any cocktail.”', 'This recipe originally appeared as part of “What the #$@! Do I Do with This? Midori: What It Is and How to Use It.”']","['Add all ingredients except soda water into a shaker and dry-shake (no ice) to emulsify.', 'Add ice and shake again until well-chilled.', 'Double-strain into a Collins glass without ice and top with soda water.', 'Garnish with a dehydrated or fresh lime wheel.', '*Cucumber syrup: Add 1/2 cup sugar and 1/2 cup water into small saucepan and cook on medium heat until sugar is dissolved. Remove mixture from heat, let cool slightly, then add 6 peeled slices of cucumber (1/2-inch-thick each). Allow to steep for 10 minutes, remove solids and store in refrigerator for up to a week.']",Savory,NULL
Lion’s Tail,https://www.liquor.com/recipes/lions-tail/,"{'bourbon': '2 ounce', 'Angostura bitters': '4 dash', 'fresh lime juice': '1/2 ounce', 'ounce Simple syrup': '1/2 ounce', 'allspice dram': '1/2 ounce'}","['One of the great forgotten cocktail ingredients, allspice dram (sometimes called pimento dram), is experiencing a revival. Here it is in a classic cocktail made with bourbon and fresh lime juice.']","['Add all ingredients into a shaker with ice and shake for 10 to 15 seconds.', 'Strain into a coupe or cocktail glass.', 'Lightly express the oil from an orange peel over top.']",Savory,NULL
Benton’s Old Fashioned,https://www.liquor.com/recipes/bentons-old-fashioned/,"{'Fat-washed Four Roses bourbon': '2 ounce', 'Grade B maple syrup': '1/4 ounce', 'Angostura bitters': '2 dash'}","['Created by Don Lee of New York City’s PDT in 2007, this cocktail started the fat-washing cocktail trend that’s still active in bars all over the world.']","['Add all the ingredients into a mixing glass and stir.', 'Strain into a rocks glass with one large ice cube.', 'Express the oil of an orange peel over the cocktail and drop in the peel.', '*Fat-washed Four Roses bourbon (from Jim Meehan’s “The PDT Cocktail Book”): In a cambro/container, combine 1 750 mL bottle of Four Roses bourbon and 1 1/2 oz liquified fat from Benton’s Smoky Mountain country ham. Set aside for 4 hours to infuse. Place the container in the freezer for 2 hours. Take the container out of the freezer, and strain the bourbon from the solidified fat with terry cloth or cheesecloth.']",Savory,NULL
Bloody Caesar,https://www.liquor.com/recipes/bloody-caesar/,"{'celery salt': 'NULL', 'vodka': '11/2 ounce', 'Clamato juice': '4 ounce', 'Worcestershire sauce': '2 dash', 'Tabasco sauce': '2 dash', 'prepared horseradish': 'to taste '}",['This clam-juice-spiked Bloody Mary is the national cocktail of Canada.'],"['Coat the rim of a tall glass with celery salt, fill with ice and set aside.', 'Add remaining ingredients into a mixing glass with ice.', 'Pour back and forth into another mixing glass a few times to mix.', 'Strain into the prepared glass.', 'Garnish with a cucumber spear, lime wedge and parsley sprig.']",Savory,"[['Every Canadian I\'ve ever known is adamant that it\'s not a ""Bloody Caesar"", but simply a ""Caesar"".'], [""I'm sorry, a parsley sprig?""], ['Even the photographer got that part right.'], [""Thank you, you are absolutely right. It's been changed to celery stalk in the ingredients. We appreciate you helping to make our site better.""], ['As a Canadian bartender with 20 years experience, I can stand behind this recipe as a solid foundation for making a Caesar. Especially with regards to horseradish being optional, as I don’t recall it being a traditional ingredient in the Caesar’s my parents would make, long before I got behind a bar. I would say it started appearing on bar menus 10-15 years ago, with mixed reviews. If you do use horseradish, be sure to mix it well.\nSome other helpful tips:\n-If you can’t find celery salt, try using store bought steak rub or Tex-mex style seasoning, chilli powder, etc.\n-SPICE THE ICE! After rimming the glass, add lots of ice, then your worcestershire & tabasco, before the vodka and Clamato juice.\n-Try using a higher ratio of Worcestershire to tabasco than the 1:1 in this recipe. I usually do 4:1, unless the guest requests it to be mild. I prefer my Caesar to be “muddy” (extra Worcestershire) and spicy. However, like a martini, everyone has their preferences.\n-Garnishes are a wild card theses days. Lime or lemon is standard, along with celery. Cucumber, pickeled beans or asparagus are also common now. To the extreme, some bars offer things like shrimp, bacon, sliders, lobster tail, etc. To each their own.'], ['Not sure if it\'s ""authentic"", but I don\'t have celery salt but I found that Old Bay seasoning works pretty well, especially in the Caesar version.']]"
Bloody Maria,https://www.liquor.com/recipes/bloody-maria/,"{'Tequila': '2 ounce', 'Tomato juice': '4 ounce', 'Fresh lemon juice': '1/2 ounce', 'Worcestershire sauce': '4 dash', 'Tabasco sauce': '2 dash', 'Tapatio hot sauce': '2 dash', 'Prepared horseradish': '1/2 tbsp', 'Celery salt': '1 pinch', 'Ground black pepper': '1 pinch'}","['Tequila shoulders out vodka in this south-of-the-border spin on the brunch-favorite Bloody Mary. Laced with two brands of hot sauce, the Bloody Maria gains extra kick from a hefty dose of horseradish and is generously garnished with a cucumber spear, jalapeño slices and queso fresco. Make your next brunch a fiesta with this tequila-spiked Bloody Mary.']","['Add all the ingredients to a shaker and fill with ice.', 'Shake briefly and strain into a pint glass filled with fresh ice.', 'Garnish with a lime wedge, a lemon wedge, a cucumber spear and a skewer of sweet pepper slices, jalapeño slices and queso fresco.', '.']",Savory,NULL
Michelada,https://www.liquor.com/recipes/michelada/,"{'Salt': 'NULL', 'Cayenne pepper': 'NULL', 'Lime juice': '1/2 ounce', 'Tabasco sauce': '2 drops', 'Worcestershire sauce': '2 dash', 'Ground black pepper': '1 pinch', 'Celery salt': '1 pinch', 'Mexican lager beer ': 'NULL'}","['The classic Mexican Michelada recipe kicks up the flavor of a cold beer. We break down the steps to the Michelada, or Chelada as some call it, to make it easy.']","['Rub the lime wedge along half the rim of the pint glass and dip into a mix of equal parts salt and cayenne pepper.', 'Add the remaining ingredients except the beer.', 'Fill with beer and garnish with a fresh lime wedge if you like.']",Savory,NULL
Bloody Mary,https://www.liquor.com/recipes/classic-bloody-mary/,"{'Lemon': '1 wedge', 'Lime': '1 wedge', 'vodka': '2 ounce', 'tomato juice': '4 ounce', 'Tabasco sauce': '2 dash', 'prepared horseradish': '2 tsp', 'worcestershire sauce': '2 dash', 'celery salt': '1 pinch', 'ground black pepper': '1 pinch', 'smoked paprika': '1 pinch'}","['The Bloody Mary is a vodka-soaked nutritional breakfast and hangover cure all in one. What else could you ask for?', 'The tomato-based cocktail has hundreds of variations, from heavy on the hot sauce to a splash of Guinness on top. It’s best to start with the classic recipe and work toward the way you like it, even if it’s topped with a shrimp skewer, a slice of bacon and a tiny cheeseburger. Crazy garnishes aside, there’s a reason this iconic beverage is a classic.', ""While the origin of this popular brunch cocktail is debatable, the Bloody Mary's staying power leaves no question.""]","['\x7fPour some celery salt onto a small plate.', 'Rub the juicy side of the lemon or lime wedge along the lip of a pint glass.', 'Roll the outer edge of the glass in celery salt until fully coated.', 'Fill with ice and set aside.', 'Squeeze the lemon and lime wedges into a shaker and drop them in.', 'Add the remaining ingredients and ice and shake gently.', 'Strain into the prepared glass.', 'Garnish with a parsley sprig, 2 speared green olives and a lime wedge and a celery stalk (optional).']",Savory,"[['this is NOT a complicated cpcktail I hava nad old mr bpstns bartender guide and some of these ingredients are new/made up-- no horseradish or smoked paprika needed'], ['Good recipe. Could I use rum instead of vodka?'], ['We support experimenting and making drinks however you like, but for this drink, a better substitution might be gin.']]"
Mad Fish,https://www.liquor.com/mad-fish-cocktail-recipe-4802636,"{'sushi grade tuna': '1 small chunk', 'vodka': '1 ounce', 'triple sec': '2/3 ounce', 'Domaine de Canton ginger liqueur': '1 dash', 'pineapple juice': '1 ounce', 'lime juice': '3/4 ounce', 'coconut syrup': '1/2 ounce'}","['The exact recipe at Le Méridien Bora Bora resort in French Polynesia is a closely guarded secret, but this one is pretty close (you’ll only be missing the views of overwater bungalows and Mount Otemanu). If you want to add a little heat, muddle a thin slice or two of jalapeño along with the tuna.', '\xa0This recipe originally appeared as part of “Why the Mad Fish Is a Drink You Need to Know.”']","['Muddle the tuna in a shaker.', 'Add remaining ingredients and ice, and shake for at least 1 minute until well-chilled.', 'Double-strain into a snifter.', 'Garnish with a dash of ground black pepper.']",Savory,NULL
Aquavit Buck,https://www.liquor.com/aquavit-buck-cocktail-recipe-4802019,"{'aquavit': '2 ounce', 'lime juice': '3/4 ounce', 'ginger syrup': '3/8 ounce', 'carrot cordial': '3/8 ounce', 'Soda': 'to top'}","['Zachary Faden, the head bartender at Brasserie Liberté in Washington, D.C, calls Grand Marnier and carrots a “wonderful and uncommon pairing.” Here, they’re used in a fun riff on the classic buck. “The Grand Marnier marries with the ginger and accentuates the herbaceous aquavit,” he says.', 'This recipe originally appeared as part of “What the #$@! Do I Do with This? Grand Marnier: What It Is and How to Use It.”']","['Add all ingredients into a mixing glass with ice and shake.', 'Strain into a Collins glass over fresh ice.', 'Garnish with a lime wedge.']",Savory,"[['So this combination would be a perfect example of a cocktail on a sampler menu paired with a small bite like pastrami on dark Rye of a beet bite. The Aquvit flavor would be new to so many patrons and it is a delightful change of pace. Something that says ""Hey now"". I think its very original']]"
Vladimiry,https://www.liquor.com/recipes/vladimiry/,"{'Vodka': '13/4 ounce', 'Carrot juice': '4 ounce', 'Fresh lemon juice': '3/4 ounce', 'Celery salt': '1/4 tsp', 'Black pepper': '1/4 tsp', 'Caraway seeds': '1/4 tsp', 'Horseradish': '1/2 tsp', 'Shallot, roughly chopped': 'NULL'}","['If you’re getting tired of the same old Bloody Mary recipe, it’s time to meet her distant cousin from the East, the Vladimiry.']","['Add all ingredients into a blender and blend until smooth.', 'Pour into a highball glass over ice and stir lightly.', 'Garnish with a pickle spear and 2 sprigs of dill.']",Savory,NULL
Dirty Martini,https://www.liquor.com/recipes/dirty-martini/,"{'Gin or vodka': '21/2 ounce', 'dry vermouth': '1/2 ounce', 'olive brine': '1/2 ounce'}","[""In 1901, New York bartender John O'Connor found inspiration for the Dirty Martini in the classic Martini's famous olive garnish. First made by muddling the olive into the drink, and later by adding a splash of olive brine, the Dirty Martini took decades to reach a wide fan base. Today, it’s the go-to sipper for salt-craving drinkers.""]","['Add all the ingredients into a mixing glass with ice and stir.', 'Strain into a chilled cocktail glass.', 'Garnish with 2 to 4 olives, skewered.']",Savory,"[['Great with jalapeno stuffed olives....'], ['Sounds good! Thanks for your comment.'], ['No vermouth...straight with vodka'], ['Favorite drink.'], ['hate it with vermouth, i only use the brine. also, try it with blue cheese stuffed olives, so good!'], ['Only two olives? This is a drink AND a snack!'], ['I like mine EXTRA dirty with Bleu Cheese stuffed olives!!!'], ['Where can you buy just olive brine without the olives? Anyone got any ideas?'], ['Most liquor stores and large grocery stores with a cocktail section will have it. Same with Amazon. Or better yet, just buy cheap jars of olives and enjoy some good snacks.'], ['Amazon caries a variety of brands. Total Wine & More does as well.']]"
Black Betty,https://www.liquor.com/recipes/black-betty/,"{'El Jimador blanco tequila ': '11/2 ounce', 'Odd Society crème de cassis ': '1/2 ounce', 'Pressed lime juice': '1 ounce', 'Black sesame orgeat': '1/4 ounce', 'egg white': '1 ounce', 'Activated charcoal': '1/2 tsp'}","['At one of downtown Vancouver’s celebrated farm-to-table restaurants, Royal Dinette, bar manager Kaitlyn Stewart plays with kitchen ingredients and techniques in her cocktails. The Black Betty intrigues with its dark depths and dehydrated beetroot-sugar garnish dusted across a layer of egg white.']","['Combine all the ingredients into a mixing tin, and dry shake to emulsify egg white.', 'Add ice and shake again for 10 to 15 seconds.', 'Fine-strain into small rocks glass but with no ice.', 'Garnish with dehydrated beetroot sugar.', '*Black sesame orgeat syrup: Lightly toast 2 cups of black sesame seeds in a pan. Let cool, then blend in a blender or food processor. In a separate saucepan, bring 1 1/2 cups sugar and 1 1/4 cups water to a light simmer. Once the sugar has dissolved, add the blended sesame seeds to the saucepan. Bring to a boil over medium heat, then remove from heat and cool for 3 hours. Once the mixture has cooled, strain through a fine-mesh strainer or cheesecloth until silky. Add 1 tsp orange blossom water and 1 oz vodka. Bottle and refrigerate. Can be stored for up to 3 months.', '**Dehydrated beet sugar: Juice 4 large beets, take the pulp (or byproduct), and ring out excess juice using a kitchen towel or cheese cloth. Spread the pulp onto a tray, and place the tray in a dehydrator or oven at 120 degrees Fahrenheit. Once the pulp is completely dry, add it to a spice grinder or blender with 1/2 cup white sugar, then blitz into a fine powder. Makes 1 cup.']",Savory,"[['As a medic I have never seen a drink with activated charcoal.....'], ['Made this little number this week. It was delicious. Now to use the orgeat in other cocktails ... the hunt is on.'], ['Glad to hear you enjoyed the drink. Happy hunting!']]"
