酒名,url,酒譜,介紹,步驟,口味,評論
Suffering Bastard,https://www.liquor.com/recipes/suffering-bastard/,"{'Bourbon': '1 ounce', 'London dry gin': '1 ounce', 'Fresh lime juice': '1/2 ounce', 'Angostura bitters': '2 dash', 'Ginger ale': 'to top'}","['So many classic cocktails are born in the bars of great hotels. Originally conceived as a hangover cure by the bar staff at Cairo’s Shepherd’s Hotel (before it burned to the ground in 1952), this bourbon- and gin-based drink has been around for 70 years. To adjust the potency—or get a jump on tomorrow’s hangover—simply increase or decrease the amount of ginger ale.']","['Add the bourbon, gin, lime juice and bitters into a shaker with ice and shake until well-chilled (about 30 seconds).', 'Strain into a Collins glass over fresh ice.', 'Top with the ginger ale.', 'Garnish with a mint sprig.']",Fruity,"[['That’s not accurate. The drink was popular in Paris in 1944...get your facts straight'], [""It was invented by the bartender Joe Scialom (who worked there from 1937 to 1952) at Shepheard's Hotel, Cairo, during WWII. It's entirely plausible that Commonwealth troops spread the cocktail from Cairo to Paris.""], ['Just watched Josh Gates on “expedition unknown” and saw the story about this Joe Scialom from the LONG BAR. Great answer Sarah .']]"
CBD Spritz,https://www.liquor.com/recipes/cbd-spritz/,"{'vodka': '1 ounce', 'Aperol': '1 ounce', 'sparkling wine': '2 ounce', 'Sprig CBD-infused zero-sugar sparkling citrus soda': '2 ounce'}","['The latest hemp product to capture the imagination of chefs and bartenders, CBD soda provides all of marijuana’s therapeutic benefits minus the stony side effects. Here it’s used to add mellow citrus notes to a classic French Spritz.']","['Add all ingredients into a double rocks glass over ice and stir.', 'Garnish with a grapefruit slice.']",Fruity,[['I really Like your Recipe that you are provided above and I have make this recipe and also share this recipe to all of my friends.']]
Kamikaze,https://www.liquor.com/recipes/kamikaze/,"{'Vodka': '2 ounce', 'Orange liqueur': '3/4 ounce', 'Fresh lime juice': '3/4 ounce'}","['The Kamikaze was designed to cut to the chase. Invented on an American naval base in Japan after World War II and made popular during the great reign of vodka of the 1970s and ’80s, the Kamikaze isn’t the kind of cocktail bartenders sit around contemplating in hushed, reverent tones.', 'In fact, it’s not really a cocktail at all. The combination of vodka, lime juice and orange liqueur is served ice-cold as a shot and consumed, more often than not, in less time than it takes to assemble.', 'Which is not to suggest you approach the task haphazardly. The key to mixing a great shooter is to strip out the loose ends and focus on the bold and bracing. Its journey, after all, is a fast one.', 'This recipe calls for a full two ounces of vodka, and fresh lime juice as opposed to sour mix or Rose’s lime cordial, neither of which delivers the same tangy bite that gives the Kamikaze its backbone. Be sure to shake thoroughly for at least 10 seconds and double-strain to sift out any ice shards. In the end, you’ll have enough for two shots, because cutting to the chase is a team sport.']","['Makes 2 shots.', 'Add all the ingredients into a shaker with ice, and shake thoroughly until well-chilled.', 'Double-strain into two shot glasses.']",Fruity,NULL
Daiquiri,https://www.liquor.com/recipes/daiquiri/,"{'light rum': '2 ounce', 'fresh lime juice': '1 ounce', 'demerara sugar syrup': '3/4 ounce'}","['No drink has suffered more abuse than the Daiquiri. In the roughly 130 years since its inception, the granddaddy of rum cocktails has gone from the pride of Havana to an unloved extra on the back of a Señor Frog’s table tent. Even today, as the craft cocktail movement reaches full tilt, most people too often associate the Daiquiri with adult slushies, the stuff of spring break blackouts and mind-splitting hangovers.', 'But in its purest form, the Daiquiri is simple and sublime, a delicate blend of rum’s sweetness with the raw freshness of sugar and lime juice. Whole lives have been dedicated to balancing the three. That each ingredient should be of the highest quality goes without saying, though even then the Daiquiri can throw you a curve. Choose a too-sweet rum, and you’re sipping liquid candy; overdo the citrus, and the cocktail drowns in a puckering pool of acidity.', 'Our recipe walks the knife edge with a mix of light rum and a darker demerara sugar syrup. The two bring out the best qualities in each other. One trick when juicing the limes: Use a hand-squeezer (or your own hands). The oils from the rind add an extra flash of intensity that gives the cocktail a nice, bright edge.']","['Add all the ingredients into a shaker with ice, and shake until well-chilled.', 'Strain into a chilled coupe.', 'Garnish with a lime twist.']",Fruity,"[['I feel that the demarara was a bit too sweet and dominant. Maybe a simple syrup, and a little less of it?\nI used an artisinal white rum.'], ['""No drink has suffered more abuse..."", don\'t forget the martini!'], ['Please, may you get the recipes in metric system too?'], ['1oz = about 30ml']]"
Bourbon Strawberry Iced Tea,https://www.liquor.com/recipes/bourbon-strawberry-iced-tea/,"{'fresh strawberries ': '2 Large', 'Fresh lemon juice': '1 ounce', 'bourbon': '2 ounce', 'Simple syrup ': '3/4 ounce', 'Unsweetened iced tea': 'to top'}","['Bourbon, strawberries and iced tea come together to make this mellow summer sipper, perfect for the Fourth of July or any other day you’re craving something tall, cool and easy-drinking.']","['Add the strawberries and lemon juice into a shaker and gently muddle.', 'Add the bourbon and simple syrup, add ice, and shake until well-chilled.', 'Strain into a Collins glass over fresh ice.', 'Top with unsweetened iced tea.', 'Garnish with a mint sprig and skewered blueberries and strawberries.']",Fruity,"[['Well balanced, easy to drink, great color. This cocktail is for everyone (in a good way).']]"
Samarian Sunset,https://www.liquor.com/recipes/samarian-sunset/,"{'White rum': '11/2 ounce', 'Cabbage rum': '1/2 ounce', 'Triple sec': '3/4 ounce', 'Simple syrup': '3/4 ounce', 'Sparkling water': '3 ounce', 'Grapefruit juice': '3/4 ounce', 'Lime juice': '1/2 ounce', 'Salt': '1 pinch'}","['“Conundrum,” the episode of “Star Trek: The Next Generation” in which everyone gets their memories erased and Data thinks he’s a bartender, is one of the series’ best. He makes this drink for Troi after losing a game of 3-D chess. It goes from clear to green to red in the blink of an eye. We don’t yet have the technology to recreate that marvel, but we can mimic it using a trick with red-cabbage-infused rum. The drink will turn from purple to red with the addition of the fruit juices.', 'This recipe originally appeared as part of “5 ‘Star Trek’ Cocktails to Try at Home.”']","['Chill a large snifter with ice and set aside.', 'Add the white rum, cabbage rum, triple sec and simple syrup to a shaker with ice, and shake vigorously for 15 seconds.', 'Strain into the chilled snifter.', 'Add 3 oz sparkling water.', 'In a separate container, combine 3/4 oz grapefruit juice and 1/2 oz lime juice. Pour the juice into the snifter.', 'Add 1 pinch salt.', '*Cabbage rum: Combine 1/2 head purple cabbage, chopped, with 4 oz white rum in a blender, and blend on high until smooth. Strain using a fine-mesh strainer. Makes 4 oz.']",Fruity,NULL
Sparkling Watermelon Punch,https://www.liquor.com/recipes/sparkling-watermelon-punch/,"{'mini watermelon': '1', 'Mint leaves': '6', 'vodka': '4 ounce', 'fresh lime juice': '2 ounce', 'ounce Simple syrup': '1 ounce', 'sparkling wine': 'to top'}","['Some people look at a watermelon and all they see is ... watermelon. But summer’s superstar fruit has the potential to be so much more. This fun seasonal recipe turns the juicy orbs into a boozy punch for two, adding vodka, fresh mint and sparkling wine for a drink that looks as good as it tastes. Now that’s something we can raise our rinds to!']",[],Fruity,NULL
Peach Me,https://www.liquor.com/recipes/peach-me/,"{'Luxardo maraschino cherry': '1', 'orange': '1 slice', 'Angostura orange bitters': '3 dash', 'Woodford Reserve bourbon': '21/2 ounce', 'peach schnapps': '1/2 ounce'}","['“Peach goes well with orange, ginger and vanilla to complement these flavors and bring out the fruitiness,” says Jason Shullo, the corporate director of beverage for Golden Entertainment, which operates casinos and resorts in Nevada and Maryland. It works well in bourbon-based drinks like Smashes, Cobblers or Juleps. In his nuanced version of an Old Fashioned, the bourbon plays up the liqueur’s peach notes while bitters temper its sweetness.', 'This recipe originally appeared as part of “What the #$@! Do I Do with This? Peach Schnapps. What It Is and How to Use It.”']","['Muddle the cherry, orange slice and bitters in a mixing glass.', 'Add the bourbon, schnapps and ice and stir until well-chilled.', 'Strain into a rocks glass over a large ice sphere.', 'Garnish with a dehydrated or fresh orange slice.']",Fruity,NULL
Summerthyme Screwdriver,https://www.liquor.com/recipes/summerthyme-screwdriver/,"{' Orange ': '5 wheels ', 'Lemons': '2', 'Vodka': '11 ounce', 'Aperol': '51/2 ounce', 'Fresh orange juice': '17 ounce', 'Club soda': 'to top'}","['The simple Screwdriver (vodka and orange juice) is an essential tool in the cocktail kit: tall, refreshing and almost impossible to screw up. But add a few bells and whistles, like fresh thyme and bitter Aperol, and you have the makings of a summer blockbuster.']","['Serves 6-7.', 'Lightly muddle the orange wheels at the bottom of a pitcher.', 'Hand-squeeze the lemons into the pitcher, and discard the shell.', 'Add the vodka, Aperol and orange juice and fill with ice.', 'Top with the club soda and gently stir.', 'Garnish with thyme sprigs and orange wheels.', 'Serve in a Collins glass.']",Fruity,NULL
Spiced Margarita,https://www.liquor.com/recipes/spiced-margarita/,"{'Lime': '1 wedge', ' Jalapeño': '3 wheels ', 'Blanco tequila': '2 ounce', 'Amaretto': '3/4 ounce', 'Fresh lime juice': '1 ounce'}","['Joan Villanueva, the beverage curator at BO-beau kitchen + caché in San Diego, sees a lot of application for amaretto with bold and spicy flavors like mezcal, tequila and rye. In this Margarita version, amaretto stands in for orange liqueur, and muddled jalapeño slices lend a touch of lip-tingling heat.', 'This recipe originally appeared as part of “What the #$@! Do I Do with This? Amaretto: What It Is and How to Use It.”']","['Rub half of the outside of a rocks glass with a lime wedge, dip in salt to coat and set aside.', 'Add the jalapeño wheels into a shaker and gently muddle.', 'Add the tequila, amaretto, lime juice and ice and shake until well-chilled.', 'Strain into the prepared glass over fresh ice.', 'Garnish with a lime wheel.']",Fruity,NULL
Forest Sprite,https://www.liquor.com/recipes/forest-sprite/,"{'Citadelle gin': '11/2 ounce', 'Fresh lemon juice': '1/2 ounce', 'Pine syrup': '1/2 ounce', 'Seltzer': 'to top', 'Cocktailpunk Alpino cocktail bitters': '3 dash'}","[""This whimsical pine-laced gin cocktail tastes like someone folded up the forest floor and put it in a glass. Using a floral juniper-forward gin works well with heavy pine syrup, which you can make yourself by harvesting new fronds from that tree outside. Drink this after tromping through the woods, by the fire or whenever you want a winter drink that's also refreshing."", 'This recipe originally appeared as part of “6 Gin Drinks Perfect for Sipping by the Fireplace.”']","['Add all ingredients except the seltzer into a mixing glass with ice and stir well.', 'Strain into a Collins glass over ice.', 'Top with the seltzer and bitters.', 'Garnish with a lemon twist and pine sprig.', '*Pine syrup: In a medium pot, add 1/4 cup roughly chopped conifer tips to 1 cup boiling water and 1 cup granulated sugar. Stir until sugar dissolves, remove heat and let cool for 30 minutes. Strain into a sealable container and refrigerate. Good for up to 2 weeks.']",Fruity,NULL
Rum Punch,https://www.liquor.com/recipes/rum-punch/,"{'light rum': '11/4 ounce', 'dark rum': '11/4 ounce', 'pineapple juice': '2 ounce', 'fresh orange juice': '1 ounce', 'fresh lime juice': '1/4 ounce', 'grenadine': '1/4 ounce'}","['Rum and fruit juice are as perfect a pairing as you’ll find in the cocktail universe. This single-serving Rum Punch mixes two types of rum with pineapple and orange juice, plus a touch of lime juice to cut through the tropical sweetness. Entertaining a crowd? Simply scale up the measurements to fit your punch bowl and add a few slices of fresh fruit for a Rum Punch that keeps on giving.']","['Add all ingredients into a shaker with ice and shake until well-chilled.', 'Strain into a Hurricane glass over fresh ice.', 'Garnish with a maraschino or brandied cherry.']",Fruity,"[['Can u please tell me da amount for a gallon'], [""This recipe makes about 6 ounces of punch before adding ice, so as commenter Stanley has noted, you'd multiply each quantity by 20 to make a gallon. Cheers!""], ['Take the recipe and multiply by 20.']]"
Latitude 29 Mai Tai,https://www.liquor.com/recipes/mai-tai/,"{'Coruba dark Jamaican rum': '1 ounce', 'Rhum Clément V S O P  Martinique rhum agricole vieux': '1 ounce', 'Orange curaçao': '1/2 ounce', 'Latitude 29 Formula orgeat': '1/2 ounce', 'Fresh lime juice ': '1 ounce', 'Simple syrup ': '1/4 ounce'}","['The Mai Tai is the quintessential torch carrier of Tiki. It made its flowery foray into American culture between the 1930s and ’50s, thanks to tropical-minded entrepreneurs like Ernest Raymond Beaumont Gantt (a.k.a. Donn Beach) and Victor Jules Bergeron (a.k.a. Trader Vic). This classic recipe comes from Tiki historian Jeff “Beachbum” Berry, the owner of New Orleans’ ode to Tikidom, Latitude 29.', 'This recipe originally appeared as part of “How the Mai Tai Became the Calling Card for the Tiki Movement.”']","['Add all the ingredients into a shaker with 2 scoops of crushed ice, and shake well for 10 seconds.', 'Pour unstrained into a double Old Fashioned glass.', 'Sink the spent lime shell into the drink.', 'Garnish with a mint sprig.']",Fruity,NULL
Blue Hawaiian,https://www.liquor.com/recipes/blue-hawaiian/,"{'Light rum': '11/2 ounce', 'Blue curaçao': '3/4 ounce', 'Pineapple juice': '2 ounce', 'Creme de coconut': '3/4 ounce', 'Fresh lemon juice': '1/2 ounce'}","['Not to be confused with the Harry Yee classic, the Blue Hawaii, the Blue Hawaiian is little more than a Piña Colada with an added splash of blue curaçao. Tall, teal and aggressively tropical, it’s the type of drink you’d imagine sipping by the swimming pool, another cocktail du azure.']","['Add all ingredients into a shaker with ice and shake until well-chilled.', 'Strain into a Hurricane glass over pebble ice.', 'Garnish with a pineapple wedge, cherry and cocktail umbrella. into glass.']",Fruity,NULL
Lounge Chair Afternoon,https://www.liquor.com/recipes/lounge-chair-afternoon/,"{'Croft pink port': '11/2 ounce', 'Siete Leguas añejo tequila': '3/4 ounce', 'Grapefruit juice': '3/4 ounce', 'Fresh lemon juice': '1/2 ounce', 'Simple syrup': '1/2 ounce'}","['“Pink port has lovely hints of fresh berries and a light natural sweetness and makes for very sessionable cocktails,” says Lulu Martinez, director of events for Liquid Productions in Aston, Pa. Straddling somewhere between a white and a ruby, this style works with everything from gin and vodka to tequila and rum. “Port’s lower alcohol levels with vibrant flavors add a fantastic component for playing off other spirits.”', 'This recipe originally appeared as part of “What the #$@! Do I Do with This? Port: What It Is and How to Use It.”']","['Add all ingredients into a shaker with ice and shake until well-chilled.', 'Strain into a double Old Fashioned glass over fresh ice.', 'Garnish with half of a grapefruit wheel.', '*Tarragon simple syrup: Combine 1 cup white sugar and 1 cup water in a small saucepan. Bring to a boil, reduce heat and simmer until sugar is dissolved. Remove from the heat and add 1/4 cup fresh tarragon sprigs. Steep for 15 minutes or until desired flavor is achieved, then strain out solids.']",Fruity,NULL
Brown Derby,https://www.liquor.com/recipes/brown-derby/,"{'Bourbon': '11/2 ounce', 'Fresh grapefruit juice': '1 ounce', 'Honey syrup': '1/2 ounce'}","[""The classic bourbon Brown Derby cocktail is named for the eponymous hat-shaped Los Angeles diner. It's both sweet and sour with a hefty dose of grapefruit juice and a touch of honey syrup. Try this recipe now to find out what all the hype is about.""]","['Add all ingredients into a shaker with ice and shake.', 'Fine-strain into a cocktail glass.', 'Express the oil from a grapefruit twist and drop in to garnish (or garnish with a grapefruit wedge).', '*Honey syrup: Add 1/2 cup honey and 1/2 cup water to a small saucepan over medium heat. (You can experiment and decide how much of a honey flavor you want in your syrup. The more honey you use, the thicker the syrup and stronger in flavor it will be.) Stir until blended. Strain into a jar and seal tightly with a lid. Will keep for 1 month in the refrigerator.']",Fruity,"[['Very refreshing drink, the honey mellows the bitterness of the grapefruit just enough but neither overpower the drink which allows the bourbon to retain the backbone (though I do prefer a bottle in bond bourbon that stands up a little more to the grapefruit juice).'], ['we loved it adding to our list of cocktails - I was lucky enough to have eaten at the BrownDerby...........']]"
Bulleit Bourbon Kentucky Buck,https://www.liquor.com/recipes/bulleit-bourbon-kentucky-buck/,"{'Fresh lemon juice': '1/2 ounce', 'Medium strawberry': '1', 'Bulleit bourbon': '11/2 ounce', 'Simple syrup': '1/2 ounce', 'Angostura bitters': '2 dash', 'Ginger beer': 'to top'}","[""Love bourbon? Don't miss this simple and delicious whiskey drink.""]","['In a shaker, muddle the lemon juice and strawberry.', 'Add the bourbon, simple syrup, bitters and ice and shake.', 'Strain into a Collins glass over fresh ice.', 'Top with the ginger beer.', 'Garnish with a skewered lemon wheel and a thinly sliced strawberry.']",Fruity,NULL
Margarita,https://www.liquor.com/recipes/margarita/,"{'Blanco tequila': '2 ounce', 'Fresh lime juice': '1 ounce', 'Orange liqueur': '1/2 ounce', 'Agave syrup': '1/2 ounce'}","['The Margarita is one of the most popular cocktails in North America—for good reason. Combining the tang of lime and the sweetness of orange liqueur with the distinctive strength of tequila, our classic Margarita strikes all of the right keys.', ""Although many people reach for premade sour mix, we highly recommend using fresh lime juice. The end result is—let's face it—superior."", 'When talking Margaritas, it’s easy to get lost in stories about who invented the drink or get mired in debates over salt versus no salt; blended or frozen; triple sec, Cointreau or Grand-Marnier. In our opinion, this version is the tried-and-true recipe for the best Margarita you can make. Memorize it, and you’ll always impress.']","['Add all the ingredients into a shaker with ice, and shake until chilled.', 'Strain into the prepared rocks glass over fresh ice.', 'Garnish with a lime wheel and kosher salt (optional).']",Fruity,"[[""If you want a fantastic Margarita - forget Tequila and use a good Mezcal.\nYou won't go back.""], ['This is amazing news - I got a bottle for my birthday!!'], [""hello! i can't seem to find the margarita recipe authored by dale degroff anymore--it was hosted here for years, and was my go-to. where is it located on the liquor.com site, or did it disappear?""], ['Dale Degroff’s Recipe\n1½ oz Tequila\n1 oz Cointreau\n¾ oz Lime Juice\n¼-½ Simple Syrup'], ['So simple and so delicious. And who knew I actually had Shave syrup in the fridge 😀'], ['My Margaritas are made with equal parts of Tequila, triple sec and lime juice. Period. A lime wedge is added for garnish.'], ['Low on tequila, high on lime juice, kind of a rainbow sherbet kind of flavor?'], ['Great recipe!!'], ['These are so amazing! I made this recipe for a party and everyone loved it. If you’re one who likes sweetness, you can add an ounce or two of orange juice. Definitely will use this later.'], ['Thanks for your comment. Glad all enjoyed the recipe.'], [""best recipe i've found. i use simple syrup when i have no agave.""], ['Replace the agave with Lemonade and add a splash of Corona. Also can be made spicy with Jalepeno infused tequila, spicy rim and jalepeno garnish'], ['My husband wanted me to get ingredients to make a margarita. I googled margarita and found this simple recipe. I bought the liquor arrived home and he was furious, no sour mix, this won’t make a margarita. I told him I’m going to make one. I made me a drink and he tried mine and took it. He was blown away at how much it tasted like a margarita, but with more flavor and it’s smoothness. This is the best margarita I’ve ever made at home. Thank you for posting the recipe.'], [""It's just wonderful when you find a recipe that you both enjoy! Cheers!""]]"
Tequila Sunrise,https://www.liquor.com/recipes/tequila-sunrise/,"{'Blanco tequila': '2 ounce', 'Fresh orange juice': '4 ounce', 'Grenadine': '1/4 ounce'}","['The Tequila Sunrise, with its bright striations of color, evokes a summer sunrise. This simple classic has only three ingredients—tequila, grenadine and orange juice—and is served unmixed to preserve the color of each layer.', 'The Tequila Sunrise was created by Bobby Lozoff and Billy Rice in Sausalito, Calif. The cocktail achieved notoriety after Mick Jagger began drinking it, and The Rolling Stones dubbed their 1972 tour “the cocaine and Tequila Sunrise tour.” The drink has been a part of the cocktail canon ever since.']","['Add the tequila and then the orange juice to a chilled highball glass filled with ice.', 'Top with the grenadine, which will sink to the bottom of the glass, creating a layered effect.', 'Garnish with an orange slice and a cherry.']",Fruity,[['Good Recipe']]
New Year’s Sparkler,https://www.liquor.com/recipes/new-years-sparkler/,"{'berry-flavored vodka': '1 ounce', 'pomegranate juice': '11/2 ounce', 'Champagne': '31/2 ounce'}",['Ring it in with fruit and bubbly.'],"['Add the vodka and cranberry juice to a chilled Champagne flute.', 'Top with Champagne and garnish with raspberries on a long skewer.']",Fruity,NULL
Pimm's Cup,https://www.liquor.com/recipes/pimms-cup/,"{'Pimm’s No  1 Cup': '2 ounce', 'Sprite': '3 ounce', 'cucumber': '1 slice'}","['The Pimm’s Cup started as a health drink in 1840s London. The slow-sipping summer cocktail is the preferred vehicle for its eponymous liqueur, a gin-based digestif that spread across the globe and found a loyal fan base in New Orleans. Combined with Sprite/7Up (or ginger ale), cucumber and a medley of fruit garnishes, the drink proved to be a welcome relief from the Southern heat. The Pimm’s Cup is also the favorite cooler at Wimbledon, where it’s still enjoyed by the pitcher.']","['Add all ingredients into a highball glass over ice and stir to combine.', 'Garnish with a mint sprig, skewered strawberry and optional lemon and orange wheels.', 'To mix things up a bit, you can replace the Sprite, 7Up or ginger ale with Champagne.']",Fruity,"[[""Instead of sprite try 1 oz lemon juice, 3/4 oz (full oz won't hurt) simple syrup and 2-3oz club soda""], ['Thanks for this tip! Much better than Sprite or 7up.']]"
Caipirinha,https://www.liquor.com/recipes/caipirinha/,"{'Lime, cut into wedges': 'NULL', 'Sugar': '2 tsp', 'Cachaça': '2 ounce'}","['Chances are high you encountered Brazil’s national drink, the Caipirinha, if you’ve ever traveled to the South American country. Refreshing and easy to make, the cocktail contains fresh lime juice, sugar and cachaça—a spirit as central to Brazilian identity as samba, soccer and carnival. First made in the 1500s from the fermented juice of sugar cane, cachaça is similar to rum yet distinct for its funky, grassy flavors, setting the Caipirinha apart from other sweet-and-sour cocktails.']","['In a double Old Fashioned glass, muddle the sugar and lime.', 'Fill with ice, add the cachaça, and stir briefly.', 'Garnish with a lime wheel (optional).']",Fruity,"[['I’ve had probably a dozen different Cachaça’s and as my wife says “I love to tel American bartenders what they are doing wrong! The biggest issue here in the US is our limes aren’t as juicy. I got w 1.5 limes per drink. I personally prefer Novo Fogo’s Chmeleon Cachaça that’s aged for 1 year in an oak barrel. My second go to Ypioca Cachaca (for this one I don’t go for the gold the silver is great).'], ['Love a good Caipirinha by the pool in Mexico. While the Brazilian cachaça is better, any good white rum will work. In Puerto Vallarta, I was introduced to Caipiroska, same thing with vodka.'], ['Good aged rum is a great substitute for Cachaca in Caipirinha. Quite likely, even better for most people.'], ['First had this down in Miami and good lord, was it incredible.'], ['can buy in the states'], ['Yes. Leblon makes an outstanding Cachaça']]"
